mechanism_class,mechanism_label,rep_event,data_tier,typical_price_basis_magnitude,depth_availability_at_stress,expected_price_exec_ratio,execution_tractability,why_gap_differs,paper_claim_level
fiat_reserve_bank_shock,Fiat-Reserve Bank Shock,USDC/SVB Mar 2023,A,100–1300 bps (reserve uncertainty drives basis),Moderate — CEX depth shrinks as MMs pull quotes,~12× (empirically verified at $10K/1m),Low — basis real but executable windows rare (2.88%),Reserve uncertainty creates quoted-price gaps; MMs pull depth simultaneously,execution_grade
algorithmic_reflexive,Algorithmic / Reflexive,Terra/UST May 2022,B,Very large (100–10000 bps); terminal in UST case,Very low — terminal events exhaust all available depth,Likely >> 12× (est.); terminal events not executable,Very low — depth exhausted before execution possible,Reflexive collapse drains both sides of order book; no arbitrage depth,price_grade_est
exchange_credit_liquidity,Exchange Credit / Liquidity,FTX Collapse Nov 2022,B,Small (5–50 bps at benchmark venues); larger on FTX itself,High on non-FTX venues (Binance/Coinbase unaffected),Possibly low (2–5× est.) — depth available at benchmark venues,Potentially higher — healthy venues maintain depth,Credit shock isolated to one exchange; cross-venue depth intact,price_grade_est
regulatory_issuer_winddown,Regulatory / Issuer Winddown,BUSD Regulatory Feb 2023,B,Small (10–30 bps); orderly conversion,Moderate — Binance maintained BUSD depth during conversion,"Likely low (2–5× est.) — managed process, not panic",Higher — orderly winddown preserves some depth,Known regulatory schedule reduces panic; depth degrades slowly,price_grade_est
defi_pool_imbalance,DeFi Pool Imbalance,USDT/Curve Jun 2023,B,"Small-to-moderate (8–500 bps, larger within pool)",CEX depth mostly intact; on-chain pool liquidity depleted,Moderate (est. 5–10×) — CEX side more liquid,Moderate if CEX-only; low if requires on-chain settlement,On-chain settlement adds transfer latency and gas cost; CEX-to-DEX arbitrage harder,price_grade_est
collateral_liquidation_oracle,Collateral / Liquidation,DAI Black Thursday Mar 2020,B,"+150 bps (above peg — demand shock, not discount)",Low on DAI; ETH side depth collapsed,N/A — above-peg stress; different mechanism class,Different framing: DAI above peg means sell DAI (not buy),Collateral liquidation creates demand shock; different arb direction,price_grade_est
rwa_niche_stablecoin,RWA / Niche Stablecoin,USDR Oct 2023,B,Large (500–5000 bps est.); illiquid collateral,Very low — niche assets with thin CEX presence,Not comparable — no benchmark-venue liquidity,Very low — insufficient CEX depth for execution,Niche assets have no execution-grade CEX order books,price_grade_est
